{
  "schema": "fsusui-design-conformance.ui-ux-classification-receipt.v2",
  "ownerRepository": "Ozwasyd/FsusUI",
  "affectedSurfaces": [
    "Avalonia TableV2 content regions",
    "Contract V2 TableV2 content-region mapping"
  ],
  "uiDecisionClass": "prescribed",
  "verificationClass": "ux-path",
  "requiredAuthorities": [
    {
      "id": "design",
      "path": "docs/design.md",
      "digest": "24c88676101dde43bb0907ed173f001b6e1659973caf19701ea57eddf0617039"
    },
    {
      "id": "design-governance",
      "path": "docs/design/governance.md",
      "digest": "892896b49b21c1f37667ebec8ac7bce08c94e15f53942e0e0b10d1e8b7edb3a5"
    },
    {
      "id": "change-classification",
      "path": "docs/design/change-classification.md",
      "digest": "96a293a38282e63f67976b97b4ecfbd2802ae28812735a6259d25940d56bdc84"
    },
    {
      "id": "visual-workflow",
      "path": "docs/workflows/visual-change.md",
      "digest": "22b63749bd3ed35a4f8c174f4b8b026033bd2d645ffa39e335ba5b30489142b4"
    },
    {
      "id": "avalonia-index",
      "path": "docs/avalonia/README.md",
      "digest": "21d1319e8f5fad2c0c541b9c78ce2cb88b87c6dd40552b2d17a846128afcd506"
    },
    {
      "id": "avalonia-virtualization",
      "path": "docs/avalonia/components/virtualization.md",
      "digest": "2d01b44c296cb07a74394ba5eee35df9d75298d2f9fd6c14a14b6864182a9eb3"
    },
    {
      "id": "platform-differences",
      "path": "docs/avalonia/platform-differences.md",
      "digest": "96dd3a8cbb0724907d5cbead977241f33be09d1450b69953f745071d1dd2998a"
    },
    {
      "id": "api-stability",
      "path": "docs/api-stability.md",
      "digest": "4d65770a17706c8946781f13529fac477f3ec69bf3f4ac19fbd52cefc2fc5ab1"
    }
  ],
  "requiredSkillDigests": [
    "c88357a6ba0340000bae5839daeb67a3cd2722e8242cf7e0148006c3610a44fe"
  ],
  "activeBaselineIdentity": {
    "repository": "Ozwasyd/FsusUI",
    "revision": "c3bd2184effd2e75a6d86a4741a9c0cf75e806bb",
    "skillDigest": "c88357a6ba0340000bae5839daeb67a3cd2722e8242cf7e0148006c3610a44fe",
    "authorityDigest": "0ae22b000bdb8d0451880f4e9405b788c16249cd6cbdb2c6becee22bfa603d80",
    "dirtyFingerprint": "e3b0c44298fc1c149afbf4c8996fb92427ae41e4649b934ca495991b7852b855"
  },
  "candidateSha": "e9ec7e3c8145b598d41b08d3610ab6f245c258ca",
  "candidateDigest": "1a9ff9de943cd711c652d4ad3a779e0212e9f074714ba0f69e838a277d1ccb79",
  "stateEvidenceMatrix": [
    {
      "state": "two-row-scoped-header-populated-footer-empty",
      "viewport": "avalonia-headless-488x540",
      "theme": "light",
      "evidenceDigest": "12c592158d6d33a79c5e97ef319e924e65a7b118071531683551c5d13e660bc8"
    },
    {
      "state": "whole-header-loading-overlay",
      "viewport": "avalonia-headless-488x320",
      "theme": "light",
      "evidenceDigest": "3ddb0fef6bcf5080df423f22aa6ab289458032d3bc032a340f59157b3c77a16d"
    }
  ],
  "inScope": [
    "TableV2 header, header-cell, row, footer, empty, and overlay content-region rendering",
    "scalar and multi-row header heights with exact scoped payload contexts",
    "fixed light-theme Avalonia production-control renders under reduced motion"
  ],
  "outOfScope": [
    "dark-theme, mobile, zoom, screen-reader, and cross-platform pixel-equality claims",
    "unrelated TableV2 API members and public-value alignment",
    "new tokens, decoration, content, or adjacent component redesign"
  ],
  "classificationEvidenceDigest": "fef0fad090c728e09e50b5788f18facd97275cba64bbc03b2ad01ce64899c9bd",
  "domainPolicyDigest": "620c4f746c1f259e3b640044975ad2878b7913806038706f7991bee9d72104d3",
  "status": "frozen",
  "receiptDigest": "b6fa5c3fb4c6c597ce8b310d9941cc7153e9409e43af2106a1a43edf8d51c44e"
}
