{
  "schema": "fsusui-design-conformance.ui-ux-classification-receipt.v2",
  "ownerRepository": "Ozwasyd/FsusUI",
  "affectedSurfaces": [
    "Avalonia modal surface programmatic dialog and expand-collapse semantics",
    "Avalonia anchored overlay programmatic role and expand-collapse semantics"
  ],
  "uiDecisionClass": "prescribed",
  "verificationClass": "ux-local",
  "requiredAuthorities": [
    {
      "id": "design",
      "path": "docs/design.md",
      "digest": "24c88676101dde43bb0907ed173f001b6e1659973caf19701ea57eddf0617039"
    },
    {
      "id": "design-governance",
      "path": "docs/design/governance.md",
      "digest": "892896b49b21c1f37667ebec8ac7bce08c94e15f53942e0e0b10d1e8b7edb3a5"
    },
    {
      "id": "change-classification",
      "path": "docs/design/change-classification.md",
      "digest": "96a293a38282e63f67976b97b4ecfbd2802ae28812735a6259d25940d56bdc84"
    },
    {
      "id": "visual-workflow",
      "path": "docs/workflows/visual-change.md",
      "digest": "22b63749bd3ed35a4f8c174f4b8b026033bd2d645ffa39e335ba5b30489142b4"
    },
    {
      "id": "avalonia-index",
      "path": "docs/avalonia/README.md",
      "digest": "98e43870a8f1068244a2f00ce5de39ca8f39eb534590b9beabb7c7ac4cede0b2"
    },
    {
      "id": "avalonia-modal-panel",
      "path": "docs/avalonia/components/modal-panel.md",
      "digest": "8976799d8f9d9b8a8c64cca00666e906946280c783609f5ce310459652e8a58b"
    },
    {
      "id": "avalonia-anchored-overlay",
      "path": "docs/avalonia/components/anchored-overlay.md",
      "digest": "396f387b2ff441f11f7e78868625fb44ee2968047ed509b57a2ba91427e44b43"
    },
    {
      "id": "accessibility",
      "path": "spec/accessibility/README.md",
      "digest": "f149631813fbfb060d49412329638555e0f0c371fb441cf89ab46cd64a3e3de6"
    }
  ],
  "requiredSkillDigests": [
    "c88357a6ba0340000bae5839daeb67a3cd2722e8242cf7e0148006c3610a44fe"
  ],
  "activeBaselineIdentity": {
    "repository": "Ozwasyd/FsusUI",
    "revision": "3a9c2c2b2ecd8a680e4b5fda4ace1cf232b49e1e",
    "skillDigest": "c88357a6ba0340000bae5839daeb67a3cd2722e8242cf7e0148006c3610a44fe",
    "authorityDigest": "5cc44e85920cc95235602c228c81a7cb57edd917e7b71d3e85f2ed3c5021e4ed",
    "dirtyFingerprint": "e3b0c44298fc1c149afbf4c8996fb92427ae41e4649b934ca495991b7852b855"
  },
  "candidateSha": "aa1b36342ee9c345e5bdc20618cbf4cf1bfe33d7",
  "candidateDigest": "801738ca494ab32382a89821b281879bfcacf777b6e052c80a22151804ce9c69",
  "stateEvidenceMatrix": [
    {
      "state": "modal-and-anchored-overlay-role-and-expand-collapse-lifecycle",
      "viewport": "avalonia-headless-control",
      "theme": "not-applicable",
      "evidenceDigest": "f6246bfe25019af2e926a84c1ba5b1e2879e6c08570c6a1223796a9f6d613d5e"
    }
  ],
  "inScope": [
    "FsusDialog, FsusDrawer, and FsusMessageBox dialog role and expand-collapse lifecycle",
    "FsusTooltip tooltip role and expand-collapse lifecycle",
    "FsusPopover and FsusPopconfirm dialog role and expand-collapse lifecycle",
    "headless programmatic AutomationPeer and provider lifecycle verification"
  ],
  "outOfScope": [
    "visual styling, geometry, token, theme, or motion changes",
    "browser accessibility behavior",
    "cross-platform rendered or screen-reader acceptance",
    "unrelated Avalonia controls and remaining accessibility gaps"
  ],
  "classificationEvidenceDigest": "85268306bb1143318310d77e1883e4109f7b1058ed59f44db6914e108da124d7",
  "domainPolicyDigest": "620c4f746c1f259e3b640044975ad2878b7913806038706f7991bee9d72104d3",
  "status": "frozen",
  "receiptDigest": "183c0468c6f9ed9f69ac70b75aa20ebb5971427d2666f3614280b689a832564e"
}
