{
  "schema": "fsusui-design-conformance.ui-ux-classification-receipt.v2",
  "ownerRepository": "Ozwasyd/FsusUI",
  "affectedSurfaces": [
    "Avalonia FsusNotification service-helper action and dismiss geometry",
    "Avalonia notification light and dark density matrix"
  ],
  "uiDecisionClass": "prescribed",
  "verificationClass": "ux-path",
  "requiredAuthorities": [
    {
      "id": "design",
      "path": "docs/design.md",
      "digest": "24c88676101dde43bb0907ed173f001b6e1659973caf19701ea57eddf0617039"
    },
    {
      "id": "design-governance",
      "path": "docs/design/governance.md",
      "digest": "892896b49b21c1f37667ebec8ac7bce08c94e15f53942e0e0b10d1e8b7edb3a5"
    },
    {
      "id": "change-classification",
      "path": "docs/design/change-classification.md",
      "digest": "96a293a38282e63f67976b97b4ecfbd2802ae28812735a6259d25940d56bdc84"
    },
    {
      "id": "visual-workflow",
      "path": "docs/workflows/visual-change.md",
      "digest": "22b63749bd3ed35a4f8c174f4b8b026033bd2d645ffa39e335ba5b30489142b4"
    },
    {
      "id": "theme-tokens",
      "path": "docs/theme/tokens.md",
      "digest": "427a399416b901d39dc4545bd8337b153378cdeeb5ceff73419b61d308b5a0dd"
    },
    {
      "id": "token-schema",
      "path": "spec/tokens/README.md",
      "digest": "fdf27f2ad6d153acd5d0abfafd13f3106708fe4df31490f5ebed80c8061e5650"
    },
    {
      "id": "theme-customization",
      "path": "docs/theme/customization.md",
      "digest": "298ff4b6078a9b5043e65703338cf03342e9a3577dbe7e3a1b0b1bd3c686260e"
    },
    {
      "id": "avalonia-index",
      "path": "docs/avalonia/README.md",
      "digest": "660650090d7708d5121859430cb595e3de2c98ba7d65ab5f08d0d623e31411c3"
    },
    {
      "id": "service-helper",
      "path": "docs/avalonia/components/service-helper.md",
      "digest": "b07592cb1ebe9c2b119976026ebd92292cc81777456a970f3472b8a39f16b1f5"
    }
  ],
  "requiredSkillDigests": [
    "c88357a6ba0340000bae5839daeb67a3cd2722e8242cf7e0148006c3610a44fe"
  ],
  "activeBaselineIdentity": {
    "repository": "Ozwasyd/FsusUI",
    "revision": "d7cac9789c544382b854759894d2c60c8421a847",
    "skillDigest": "c88357a6ba0340000bae5839daeb67a3cd2722e8242cf7e0148006c3610a44fe",
    "authorityDigest": "de5ccd0b714395b5483cb36946b77d28217adcc60bd98a697991dd64a5d7179d",
    "dirtyFingerprint": "e3b0c44298fc1c149afbf4c8996fb92427ae41e4649b934ca495991b7852b855"
  },
  "candidateSha": "0fd2f09395566ee71f268b9c992eeeb16909ff68",
  "candidateDigest": "7054efc98e5aadc998cb7f6b5e16b48eb827e0e1be61158012fbc002f898f187",
  "stateEvidenceMatrix": [
    {
      "state": "title-message-action-dismiss-compact",
      "viewport": "desktop 600x480 notification surface 320x80",
      "theme": "light",
      "evidenceDigest": "694d94bcb1beff2c2e990e43f93c99d80b6c8c9625604447a8a9c8e8d34b9d45"
    },
    {
      "state": "title-message-action-dismiss-default",
      "viewport": "desktop 600x480 notification surface 320x80",
      "theme": "light",
      "evidenceDigest": "12e92864925dd0fd568480f5ce2dace0afcd98ec8cd60aaf1557658cb4e0f076"
    },
    {
      "state": "title-message-action-dismiss-spacious",
      "viewport": "desktop 600x480 notification surface 320x80",
      "theme": "light",
      "evidenceDigest": "a197849348531c8beee0de838e9546042461f40828b31996f09bed8337c9fc1d"
    },
    {
      "state": "title-message-action-dismiss-compact",
      "viewport": "desktop 600x480 notification surface 320x80",
      "theme": "dark",
      "evidenceDigest": "6160f4eac5e63593a4c7104575ca261f81bea68a7bf8506d4a781936ab4116c2"
    },
    {
      "state": "title-message-action-dismiss-default",
      "viewport": "desktop 600x480 notification surface 320x80",
      "theme": "dark",
      "evidenceDigest": "6a4b83888c911f6948608f38efcfc0e9766457019729b08d72cd029f44aa1789"
    },
    {
      "state": "title-message-action-dismiss-spacious",
      "viewport": "desktop 600x480 notification surface 320x80",
      "theme": "dark",
      "evidenceDigest": "22f33100e2933e5bf7356ba21666ed4ac31ec37a5eb70335171c96ea1e359e48"
    }
  ],
  "inScope": [
    "remove the direct PART_ActionButton stable-geometry literal by applying the existing inline-action button class",
    "verify title, message, action, dismiss, focus, command, and close behavior",
    "verify light and dark themes across compact, default, and spacious density modes",
    "record deterministic local Avalonia rendered evidence and its external-environment limitation"
  ],
  "outOfScope": [
    "new canonical tokens, geometry values, lint exceptions, or allowlists",
    "redesign of message, message-box, popover, tooltip, or adjacent service controls",
    "consumer persistence or composition changes",
    "physical display, native compositor, touch hardware, or screen-reader certification"
  ],
  "classificationEvidenceDigest": "f6f50a183645db676299c5f066d4845b8168ea04b80cbb14ad7535e0ff431355",
  "domainPolicyDigest": "620c4f746c1f259e3b640044975ad2878b7913806038706f7991bee9d72104d3",
  "status": "frozen",
  "receiptDigest": "757e776065b1498f91de4e792dc5ebbb0f7d1cfd200bd484c89626aafe62e9d2"
}
